{
  "$defs": {
    "RemediationAction": {
      "additionalProperties": false,
      "properties": {
        "action_id": {
          "format": "uuid",
          "title": "Action Id",
          "type": "string"
        },
        "asset_id": {
          "format": "uuid",
          "title": "Asset Id",
          "type": "string"
        },
        "baseline_sha256": {
          "pattern": "^[a-f0-9]{64}$",
          "title": "Baseline Sha256",
          "type": "string"
        },
        "depends_on": {
          "items": {
            "format": "uuid",
            "type": "string"
          },
          "title": "Depends On",
          "type": "array"
        },
        "expected_device_version": {
          "maxLength": 4096,
          "minLength": 1,
          "title": "Expected Device Version",
          "type": "string"
        },
        "recovery": {
          "enum": [
            "ROLLBACK",
            "COMPENSATION",
            "MANUAL_REQUIRED"
          ],
          "title": "Recovery",
          "type": "string"
        },
        "template_id": {
          "format": "uuid",
          "title": "Template Id",
          "type": "string"
        },
        "template_version": {
          "maxLength": 4096,
          "minLength": 1,
          "title": "Template Version",
          "type": "string"
        },
        "validated_parameters_ref": {
          "format": "uuid",
          "title": "Validated Parameters Ref",
          "type": "string"
        }
      },
      "required": [
        "action_id",
        "asset_id",
        "template_id",
        "template_version",
        "expected_device_version",
        "baseline_sha256",
        "validated_parameters_ref",
        "depends_on",
        "recovery"
      ],
      "title": "RemediationAction",
      "type": "object"
    }
  },
  "$schema": "https://json-schema.org/draft/2020-12/schema",
  "additionalProperties": false,
  "properties": {
    "actions": {
      "items": {
        "$ref": "#/$defs/RemediationAction"
      },
      "minItems": 1,
      "title": "Actions",
      "type": "array"
    },
    "approval_id": {
      "format": "uuid",
      "title": "Approval Id",
      "type": "string"
    },
    "approver_id": {
      "format": "uuid",
      "title": "Approver Id",
      "type": "string"
    },
    "authorization_grant_id": {
      "format": "uuid",
      "title": "Authorization Grant Id",
      "type": "string"
    },
    "backup_evidence_ids": {
      "items": {
        "format": "uuid",
        "type": "string"
      },
      "minItems": 1,
      "title": "Backup Evidence Ids",
      "type": "array"
    },
    "change_id": {
      "format": "uuid",
      "title": "Change Id",
      "type": "string"
    },
    "expires_at": {
      "pattern": "^\\d{4}-\\d{2}-\\d{2}T\\d{2}:\\d{2}:\\d{2}(\\.\\d+)?Z$",
      "title": "Expires At",
      "type": "string"
    },
    "idempotency_key": {
      "format": "uuid",
      "title": "Idempotency Key",
      "type": "string"
    },
    "job_id": {
      "format": "uuid",
      "title": "Job Id",
      "type": "string"
    },
    "operator_id": {
      "format": "uuid",
      "title": "Operator Id",
      "type": "string"
    },
    "org_id": {
      "format": "uuid",
      "title": "Org Id",
      "type": "string"
    },
    "plan_author_id": {
      "format": "uuid",
      "title": "Plan Author Id",
      "type": "string"
    },
    "plan_id": {
      "format": "uuid",
      "title": "Plan Id",
      "type": "string"
    },
    "plan_sha256": {
      "pattern": "^[a-f0-9]{64}$",
      "title": "Plan Sha256",
      "type": "string"
    },
    "precheck_id": {
      "format": "uuid",
      "title": "Precheck Id",
      "type": "string"
    },
    "request_id": {
      "format": "uuid",
      "title": "Request Id",
      "type": "string"
    },
    "safety_contract_ids": {
      "items": {
        "format": "uuid",
        "type": "string"
      },
      "minItems": 1,
      "title": "Safety Contract Ids",
      "type": "array"
    },
    "schema_version": {
      "const": "1.0.0",
      "title": "Schema Version",
      "type": "string"
    }
  },
  "required": [
    "schema_version",
    "org_id",
    "job_id",
    "request_id",
    "change_id",
    "plan_id",
    "plan_sha256",
    "approval_id",
    "operator_id",
    "approver_id",
    "plan_author_id",
    "authorization_grant_id",
    "precheck_id",
    "backup_evidence_ids",
    "safety_contract_ids",
    "actions",
    "expires_at",
    "idempotency_key"
  ],
  "title": "ExecutionCommand",
  "type": "object"
}
