{
  "actions": [
    {
      "action_id": "00000000-0000-0000-0000-000000000009",
      "asset_id": "00000000-0000-0000-0000-000000000005",
      "baseline_sha256": "0000000000000000000000000000000000000000000000000000000000000000",
      "depends_on": [],
      "expected_device_version": "fixture-only",
      "recovery": "ROLLBACK",
      "template_id": "00000000-0000-0000-0000-00000000000a",
      "template_version": "fixture-1",
      "validated_parameters_ref": "00000000-0000-0000-0000-00000000000b"
    }
  ],
  "approval_id": "00000000-0000-0000-0000-000000000013",
  "approver_id": "00000000-0000-0000-0000-000000000014",
  "authorization_grant_id": "00000000-0000-0000-0000-000000000015",
  "backup_evidence_ids": [
    "00000000-0000-0000-0000-000000000004"
  ],
  "change_id": "00000000-0000-0000-0000-000000000012",
  "expires_at": "2026-10-29T00:00:00Z",
  "idempotency_key": "00000000-0000-0000-0000-000000000008",
  "job_id": "00000000-0000-0000-0000-000000000002",
  "operator_id": "00000000-0000-0000-0000-000000000010",
  "org_id": "00000000-0000-0000-0000-000000000001",
  "plan_author_id": "00000000-0000-0000-0000-000000000010",
  "plan_id": "00000000-0000-0000-0000-00000000000e",
  "plan_sha256": "1111111111111111111111111111111111111111111111111111111111111111",
  "precheck_id": "00000000-0000-0000-0000-000000000016",
  "request_id": "00000000-0000-0000-0000-000000000006",
  "safety_contract_ids": [
    "00000000-0000-0000-0000-00000000000f"
  ],
  "schema_version": "1.0.0"
}
